hPTM_Name,Mean Relative Abundance - Gills,Standard Deviation - Gills,SEM - Gills,Mean Relative Abundance - Kidney,Standard Deviation - Kidney,SEM - Kidney,Mean Relative Abundance - Testes,Standard Deviation - Testes,SEM - Testes
XP_003438147.1 H2B.L4 T86 GlyGly,5.778396973,3.849952648,0.785868293,0.151057813,0.182338119,0.040772043,0.214375101,0.209594153,0.049401816
XP_003438147.1 H2B.L4 K98 GlyGly,0.187234325,0.223586332,0.045639369,0.021753742,0.016141788,0.003609413,0.006974705,0.004185694,9.86577e-4
XP_003448795.2 H1.10 K113 Oxidation,5.570096622,4.103394868,0.83760197,6.5842594,5.956983138,1.332021924,0.521846416,0.189310953,0.044621019
XP_003448939.1 H2A R42 Deamidated,2.79658e-4,3.66559e-4,7.48235e-5,6.46876e-4,0.001537975,3.43902e-4,3.98191e-5,4.7446e-5,1.11831e-5
XP_003448939.1 H2A P48 Dioxidation,0.279630873,0.040694348,0.008306699,0.389594333,0.107129342,0.023954849,0.49421096,0.07099009,0.016732525
XP_003448939.1 H2A R77 Deamidated,1.493895083,1.212176084,0.247434407,0.043264808,0.141469743,0.031633596,1.039402712,0.35907508,0.084634808
XP_003451196.1 H2B 1/2 S76 GlyGly,0.859763717,0.439146883,0.089640482,0.058490557,0.047610835,0.010646106,0.077899113,0.043367244,0.010221758
XP_003451196.1 H2B 1/2 K106 Acetyl,22.82985313,4.5929317,0.937528257,7.245593189,3.160998681,0.706820793,11.15321806,4.370059483,1.030032898
XP_003451211.1 H2A K127 Amidated,3.574358097,0.201372378,0.041104965,3.511871841,0.333387693,0.074547754,2.886427006,0.181411249,0.042759041
XP_003459572.1 H2A K123 Acetyl,3.040433869,1.04987612,0.214305066,1.062027925,0.205810986,0.046020736,2.011916833,0.280653229,0.0661506
XP_005463512.2 H3 K64 GlyGly,2.356734553,1.783023841,0.363958217,0.042741468,0.027902519,0.006239193,0.254378069,0.130806487,0.030831385
XP_005463512.2 H3 R69 Deamidated,1.128160688,0.530277322,0.108242405,0.158412546,0.054396585,0.012163446,0.223447335,0.032827244,0.007737456
XP_005463512.2 H3 R83 Methyl,4.032696121,0.865918027,0.176754777,7.200567941,0.481381012,0.107640066,7.189839372,0.50925375,0.12003226
XP_005464230.1 H2A.Z isoform X1 K110 Biotin,0.052317337,0.092388848,0.018858795,0.02185524,0.042289008,0.00945611,0.334127349,0.285635734,0.067324988
XP_019209842.1 H1-like K38 GlyGly,1.753486616,0.507345347,0.103561435,1.528169597,0.857116244,0.191657019,0.130353936,0.05953614,0.014032803
XP_019209842.1 H1-like K44 4-hydroxynonenal,16.0157082,3.67932108,0.75103827,3.441485874,1.511749188,0.338037395,0.60027903,0.212822002,0.050162627
XP_019209842.1 H1-like K44 GlyGly,0.25414202,0.114943685,0.023462781,0.110102822,0.084417319,0.018876286,0.041737505,0.009358629,0.00220585
XP_025766521.1 H4-like T56 GlyGly,0.049452869000000003,0.022561761,0.0046054,0.01406065,0.017514215,0.003916297,0.030461862,0.007299381,0.001720481
XP_025766521.1 H4-like K61 Acetyl,2.648276416,0.569637591,0.116276786,1.500312968,0.285343469,0.063804739,4.645860629,0.489818143,0.115451244
XP_025766521.1 H4-like Y74 Oxidation,0.282350405,0.0424123,0.008657374,0.24604629,0.057703308,0.012902852,0.555410075,0.086887887,0.020479671
XP_025766521.1 H4-like Y74 Dioxidation,0.219427093,0.032178812,0.006568473,0.184698159,0.04046287,0.009047773,0.395199554,0.06024648,0.014200232
